{"ticker":"SWK","schema_version":"2.1.0","current":{"signal":null,"signal_source":null,"signal_started_date":null,"signal_trading_days":null,"position_strength":null,"peak_gain_pct":null},"metrics":{"trade_count":11,"avg_hold_days":17.2,"avg_gain_pct":2.2336,"avg_peak_gain_pct":7.9911,"success_rate":0.5455},"history":[{"date":"2025-10-07","close":73.19,"volume":1311600,"signal":null,"psar":76.4593},{"date":"2025-10-08","close":72.74,"volume":1372000,"signal":null,"psar":76.0684},{"date":"2025-10-09","close":69.72,"volume":2385400,"signal":null,"psar":75.7165},{"date":"2025-10-10","close":64.43,"volume":4777500,"signal":null,"psar":74.9406},{"date":"2025-10-13","close":64.49,"volume":2261000,"signal":null,"psar":73.4439},{"date":"2025-10-14","close":67.02,"volume":2620500,"signal":null,"psar":72.1567},{"date":"2025-10-15","close":67.72,"volume":1797300,"signal":null,"psar":70.7237},{"date":"2025-10-16","close":67.91,"volume":1545300,"signal":null,"psar":69.5199},{"date":"2025-10-17","close":67.85,"volume":1248200,"signal":null,"psar":68.8},{"date":"2025-10-20","close":69.09,"volume":1278300,"signal":"BUY","psar":63.2},{"date":"2025-10-21","close":70.86,"volume":1746600,"signal":"BUY","psar":63.3284},{"date":"2025-10-22","close":69.23,"volume":1379000,"signal":"BUY","psar":63.6645},{"date":"2025-10-23","close":70.4,"volume":1233500,"signal":"BUY","psar":63.9871},{"date":"2025-10-24","close":70.21,"volume":1219100,"signal":"BUY","psar":64.2968},{"date":"2025-10-27","close":72.08,"volume":2000200,"signal":"BUY","psar":64.5941},{"date":"2025-10-28","close":71.88,"volume":1993000,"signal":"BUY","psar":65.0883},{"date":"2025-10-29","close":69.96,"volume":1861100,"signal":"BUY","psar":65.7556},{"date":"2025-10-30","close":68.58,"volume":1988400,"signal":"BUY","psar":66.3696},{"date":"2025-10-31","close":67.72,"volume":3401000,"signal":null,"psar":73.43},{"date":"2025-11-03","close":66.36,"volume":3435000,"signal":null,"psar":73.2992},{"date":"2025-11-04","close":66.63,"volume":3789900,"signal":null,"psar":72.99},{"date":"2025-11-05","close":69.62,"volume":3796100,"signal":null,"psar":72.525},{"date":"2025-11-06","close":67.47,"volume":1749800,"signal":null,"psar":72.0879},{"date":"2025-11-07","close":68.27,"volume":1308100,"signal":null,"psar":71.8},{"date":"2025-11-10","close":67.94,"volume":1430000,"signal":null,"psar":71.4064},{"date":"2025-11-11","close":67.62,"volume":938600,"signal":null,"psar":71.0364},{"date":"2025-11-12","close":68.24,"volume":1059100,"signal":null,"psar":70.6886},{"date":"2025-11-13","close":67.4,"volume":1005900,"signal":null,"psar":70.3617},{"date":"2025-11-14","close":65.65,"volume":1430900,"signal":null,"psar":70.0544},{"date":"2025-11-17","close":63.67,"volume":1236400,"signal":null,"psar":69.7655},{"date":"2025-11-18","close":62.83,"volume":1404900,"signal":null,"psar":69.2723},{"date":"2025-11-19","close":62.12,"volume":1673400,"signal":null,"psar":68.5581},{"date":"2025-11-20","close":62.44,"volume":1683900,"signal":null,"psar":67.7591},{"date":"2025-11-21","close":66.15,"volume":2374500,"signal":null,"psar":67.056},{"date":"2025-11-24","close":67.19,"volume":1841700,"signal":null,"psar":61.9},{"date":"2025-11-25","close":70.73,"volume":2022300,"signal":"BUY","psar":62.019},{"date":"2025-11-26","close":71.83,"volume":1706900,"signal":"BUY","psar":62.3822},{"date":"2025-11-28","close":71.52,"volume":770900,"signal":"BUY","psar":62.9713},{"date":"2025-12-01","close":70.56,"volume":1363100,"signal":"BUY","psar":63.525},{"date":"2025-12-02","close":71.24,"volume":1274000,"signal":"BUY","psar":64.0455},{"date":"2025-12-03","close":72.53,"volume":1768800,"signal":"BUY","psar":64.5348},{"date":"2025-12-04","close":72.21,"volume":2226400,"signal":"BUY","psar":65.1968},{"date":"2025-12-05","close":72.47,"volume":1621400,"signal":"BUY","psar":65.9781},{"date":"2025-12-08","close":72.36,"volume":1365200,"signal":"BUY","psar":66.8628},{"date":"2025-12-09","close":71.88,"volume":1313600,"signal":"BUY","psar":67.6412},{"date":"2025-12-10","close":75.86,"volume":2036300,"signal":"BUY","psar":68.3263},{"date":"2025-12-11","close":76.54,"volume":1552800,"signal":"BUY","psar":69.4538},{"date":"2025-12-12","close":75.68,"volume":1484900,"signal":"BUY","psar":70.6612},{"date":"2025-12-15","close":74.15,"volume":1770900,"signal":"BUY","psar":71.6754},{"date":"2025-12-16","close":72.8,"volume":1688600,"signal":null,"psar":77.0},{"date":"2025-12-17","close":71.92,"volume":2032100,"signal":"SELL","psar":76.9014},{"date":"2025-12-18","close":72.94,"volume":1567900,"signal":"SELL","psar":76.6717},{"date":"2025-12-19","close":72.75,"volume":3355300,"signal":"SELL","psar":76.4513},{"date":"2025-12-22","close":75.24,"volume":2246300,"signal":"BUY","psar":71.16},{"date":"2025-12-23","close":74.65,"volume":1301500,"signal":"BUY","psar":71.2906},{"date":"2025-12-24","close":74.87,"volume":489000,"signal":"BUY","psar":71.4186},{"date":"2025-12-26","close":75.38,"volume":713800,"signal":"BUY","psar":71.544},{"date":"2025-12-29","close":75.14,"volume":947600,"signal":"BUY","psar":71.6669},{"date":"2025-12-30","close":75.19,"volume":854000,"signal":"BUY","psar":71.7874},{"date":"2025-12-31","close":74.28,"volume":960900,"signal":"BUY","psar":71.9054},{"date":"2026-01-02","close":76.47,"volume":1199400,"signal":"BUY","psar":72.0211},{"date":"2026-01-05","close":77.21,"volume":1415600,"signal":"BUY","psar":72.1345},{"date":"2026-01-06","close":80.76,"volume":2911700,"signal":"BUY","psar":72.3623},{"date":"2026-01-07","close":78.69,"volume":2172200,"signal":"BUY","psar":72.8698},{"date":"2026-01-08","close":81.49,"volume":2712800,"signal":"BUY","psar":73.5594},{"date":"2026-01-09","close":82.35,"volume":1846000,"signal":"BUY","psar":74.4645},{"date":"2026-01-12","close":82.41,"volume":1323600,"signal":"BUY","psar":75.5043},{"date":"2026-01-13","close":82.9,"volume":1175500,"signal":"BUY","psar":76.4194},{"date":"2026-01-14","close":83.79,"volume":1681300,"signal":"BUY","psar":77.4527},{"date":"2026-01-15","close":84.4,"volume":1287600,"signal":"BUY","psar":78.6443},{"date":"2026-01-16","close":84.61,"volume":1619400,"signal":"BUY","psar":79.6452},{"date":"2026-01-20","close":80.74,"volume":1737300,"signal":"BUY","psar":80.6378},{"date":"2026-01-21","close":83.54,"volume":1392800,"signal":"BUY","psar":80.69},{"date":"2026-01-22","close":83.73,"volume":1149300,"signal":"BUY","psar":80.69},{"date":"2026-01-23","close":82.48,"volume":1102400,"signal":"BUY","psar":81.4946},{"date":"2026-01-26","close":81.8,"volume":1651900,"signal":"SELL","psar":85.16},{"date":"2026-01-27","close":81.06,"volume":1107500,"signal":"SELL","psar":85.0812},{"date":"2026-01-28","close":79.32,"volume":1527200,"signal":"SELL","psar":84.9164},{"date":"2026-01-29","close":79.1,"volume":2004200,"signal":"SELL","psar":84.5536},{"date":"2026-01-30","close":78.66,"volume":2786900,"signal":"SELL","psar":84.0125},{"date":"2026-02-02","close":79.15,"volume":2621100,"signal":"SELL","psar":83.3312},{"date":"2026-02-03","close":80.96,"volume":2989600,"signal":"BUY","psar":77.2},{"date":"2026-02-04","close":84.63,"volume":4609200,"signal":"BUY","psar":77.3144},{"date":"2026-02-05","close":85.57,"volume":3934800,"signal":"BUY","psar":77.6258},{"date":"2026-02-06","close":89.39,"volume":2708200,"signal":"BUY","psar":78.1571},{"date":"2026-02-09","close":89.85,"volume":1663800,"signal":"BUY","psar":79.1701},{"date":"2026-02-10","close":91.76,"volume":1754900,"signal":"BUY","psar":80.1021},{"date":"2026-02-11","close":90.53,"volume":1742000,"signal":"BUY","psar":81.4009},{"date":"2026-02-12","close":89.67,"volume":1968200,"signal":"BUY","psar":82.8372},{"date":"2026-02-13","close":91.06,"volume":1888000,"signal":"BUY","psar":84.1011},{"date":"2026-02-17","close":90.9,"volume":1318500,"signal":"BUY","psar":85.2134},{"date":"2026-02-18","close":89.83,"volume":1727900,"signal":"BUY","psar":86.1922},{"date":"2026-02-19","close":89.61,"volume":2004300,"signal":"BUY","psar":87.0535},{"date":"2026-02-20","close":91.96,"volume":3221600,"signal":"BUY","psar":87.8115},{"date":"2026-02-23","close":87.29,"volume":1489400,"signal":null,"psar":93.37},{"date":"2026-02-24","close":89.25,"volume":1108000,"signal":null,"psar":93.2472},{"date":"2026-02-25","close":85.26,"volume":1827700,"signal":null,"psar":93.1269},{"date":"2026-02-26","close":87.65,"volume":1382700,"signal":null,"psar":92.795},{"date":"2026-02-27","close":86.49,"volume":2024500,"signal":null,"psar":92.4764},{"date":"2026-03-02","close":84.04,"volume":1742800,"signal":null,"psar":92.1705},{"date":"2026-03-03","close":81.63,"volume":1740300,"signal":null,"psar":91.5939},{"date":"2026-03-04","close":79.78,"volume":2427900,"signal":null,"psar":90.6368},{"date":"2026-03-05","close":77.93,"volume":2430000,"signal":null,"psar":89.7562},{"date":"2026-03-06","close":76.08,"volume":2095600,"signal":null,"psar":88.4236},{"date":"2026-03-09","close":75.62,"volume":2781638,"signal":null,"psar":86.6736},{"date":"2026-03-10","close":74.13,"volume":1325736,"signal":null,"psar":84.5521},{"date":"2026-03-11","close":73.74,"volume":1362100,"signal":null,"psar":82.7276},{"date":"2026-03-12","close":71.09,"volume":1704000,"signal":null,"psar":81.1585},{"date":"2026-03-13","close":70.15,"volume":2190100,"signal":null,"psar":79.4644},{"date":"2026-03-16","close":71.08,"volume":1209400,"signal":null,"psar":77.705},{"date":"2026-03-17","close":71.03,"volume":1467400,"signal":null,"psar":76.2623},{"date":"2026-03-18","close":69.62,"volume":1273600,"signal":null,"psar":75.0793},{"date":"2026-03-19","close":69.05,"volume":1843100,"signal":null,"psar":73.9814},{"date":"2026-03-20","close":67.28,"volume":2257200,"signal":null,"psar":72.7191},{"date":"2026-03-23","close":69.91,"volume":2388900,"signal":null,"psar":66.54},{"date":"2026-03-24","close":71.58,"volume":1855600,"signal":null,"psar":66.54},{"date":"2026-03-25","close":71.85,"volume":955100,"signal":null,"psar":66.786},{"date":"2026-03-26","close":70.81,"volume":1090400,"signal":"BUY","ps